{
  "origin": {
    "id": "1",
    "label": "Warszawa"
  },
  "destination": {
    "id": "2",
    "label": "Londyn"
  },
  "date": {
    "from": "01-04-2024",
    "to": "04-04-2024"
  },
  "price": {
    "value": 300.0,
    "currency": "z≈Ç"
  },
  "rating": 4.4,
  "availability": true,
  "image": "data:image/png;base64,iVBORw0KGgoAAAANSUhEUgAAAAgAAAAIAQMAAAD+wSzIAAAABlBMVEX///+/v7+jQ3Y5AAAADklEQVQI12P4AIX8EAgALgAD/aNpbtEAAAAASUVORK5CYII"
}
